{
  "$schema": "http://json-schema.org/draft-07/schema#",
  "type": "object",
  "properties": {
    "d1O": {
      "type": "array",
      "items": {
        "type": "number"
      }
    },
    "m1O": {
      "type": "array",
      "items": {
        "type": "number"
      }
    },
    "m1objO": {
      "type": "array",
      "items": {
        "type": "object",
        "properties": {
          "q1": {
            "type": "string"
          },
          "q2": {
            "type": "array",
            "items": {
              "type": "string"
            }
          }
        },
        "required": [
          "q1",
          "q2"
        ]
      }
    },
    "i1O": {
      "type": "array",
      "items": {
        "type": "string"
      }
    },
    "i2O": {
      "type": "array",
      "items": {
        "type": "array",
        "items": {
          "type": "string"
        }
      }
    },
    "iobjO": {
      "type": "array",
      "items": {
        "type": "object",
        "properties": {
          "p1": {
            "type": "string"
          },
          "p2": {
            "type": "array",
            "items": {
              "type": "string"
            }
          }
        },
        "required": [
          "p1",
          "p2"
        ]
      }
    },
    "d2O": {
      "type": "array",
      "items": {
        "type": "array",
        "items": {
          "type": "number"
        }
      }
    },
    "m2O": {
      "type": "array",
      "items": {
        "type": "array",
        "items": {
          "type": "number"
        }
      }
    },
    "s10O": {
      "type": "string"
    },
    "s21O": {
      "type": "array",
      "items": {
        "type": "string"
      }
    }
  },
  "required": [
    "d1O",
    "m1O",
    "m1objO",
    "i1O",
    "i2O",
    "iobjO",
    "d2O",
    "m2O",
    "s10O",
    "s21O"
  ]
}